{
  "rubricVersion": "v1",
  "generatedAt": "2026-05-23T10:00:37.764Z",
  "totalScripts": 40,
  "totalPassed": 1,
  "overallPassRate": 0.025,
  "overallThreshold": 0.9,
  "meetsOverallThreshold": false,
  "perBucket": [
    {
      "bucket": "01-happy-lookups",
      "scriptCount": 6,
      "passCount": 0,
      "passRate": 0,
      "threshold": 1,
      "meetsThreshold": false,
      "failedScripts": [
        "lookup-account-summary-known-customer",
        "lookup-appointments-next",
        "lookup-customer-confirm-info",
        "lookup-estimates-recent",
        "lookup-invoices-balance",
        "lookup-jobs-known-customer"
      ]
    },
    {
      "bucket": "02-happy-booker",
      "scriptCount": 4,
      "passCount": 0,
      "passRate": 0,
      "threshold": 1,
      "meetsThreshold": false,
      "failedScripts": [
        "cancel-appointment-known-customer",
        "create-appointment-known-customer",
        "reschedule-appointment-known-customer",
        "two-step-booking-known-customer"
      ]
    },
    {
      "bucket": "03-lead-capture",
      "scriptCount": 3,
      "passCount": 0,
      "passRate": 0,
      "threshold": 1,
      "meetsThreshold": false,
      "failedScripts": [
        "create-customer-new-signup",
        "find-or-create-lead-unknown-caller",
        "known-customer-no-signup"
      ]
    },
    {
      "bucket": "04-identity-edges",
      "scriptCount": 5,
      "passCount": 0,
      "passRate": 0,
      "threshold": 0.9,
      "meetsThreshold": false,
      "failedScripts": [
        "caller-id-blocked",
        "caller-id-matches-existing-lead-not-customer",
        "caller-id-matches-multiple-customers",
        "caller-id-matches-one-customer",
        "caller-id-mismatched-but-claims-existing"
      ]
    },
    {
      "bucket": "05-compliance-edges",
      "scriptCount": 4,
      "passCount": 0,
      "passRate": 0,
      "threshold": 0.9,
      "meetsThreshold": false,
      "failedScripts": [
        "after-hours-callback",
        "dnc-caller-terminated",
        "out-of-coverage-area",
        "stop-sent-no-sms"
      ]
    },
    {
      "bucket": "06-hangup-edges",
      "scriptCount": 3,
      "passCount": 1,
      "passRate": 0.3333333333333333,
      "threshold": 0.9,
      "meetsThreshold": false,
      "failedScripts": [
        "hangup-mid-confirmation",
        "hangup-post-proposal"
      ]
    },
    {
      "bucket": "07-out-of-scope",
      "scriptCount": 4,
      "passCount": 0,
      "passRate": 0,
      "threshold": 0.9,
      "meetsThreshold": false,
      "failedScripts": [
        "add-note-escalated",
        "payment-request-escalated",
        "update-customer-escalated",
        "vague-complaint-escalated"
      ]
    },
    {
      "bucket": "08-ambiguity",
      "scriptCount": 4,
      "passCount": 0,
      "passRate": 0,
      "threshold": 0.7,
      "meetsThreshold": false,
      "failedScripts": [
        "accent-uncertain-confidence",
        "mumble-low-confidence-reprompt",
        "partial-info-incomplete",
        "two-intents-one-sentence"
      ]
    },
    {
      "bucket": "09-concurrency",
      "scriptCount": 3,
      "passCount": 0,
      "passRate": 0,
      "threshold": 0.7,
      "meetsThreshold": false,
      "failedScripts": [
        "customer-just-archived-mid-call",
        "slot-just-taken-by-other-call",
        "stale-appointment-just-cancelled"
      ]
    },
    {
      "bucket": "10-adversarial",
      "scriptCount": 4,
      "passCount": 0,
      "passRate": 0,
      "threshold": 0.7,
      "meetsThreshold": false,
      "failedScripts": [
        "cost-cap-drain",
        "cross-customer-extraction",
        "spam-create-customer",
        "sql-injection-text"
      ]
    }
  ],
  "perScript": [
    {
      "scriptId": "accent-uncertain-confidence",
      "bucket": "08-ambiguity",
      "passed": false,
      "floorResult": {
        "passed": true,
        "failedCriteria": [],
        "reasons": {}
      },
      "dispositionStructuredResult": {
        "passed": false,
        "failedCriteria": [
          9
        ],
        "reasons": {
          "9": "turn 0: expected intent 'create_appointment', got '<none>'"
        },
        "perTurnDetail": [
          {
            "turnIndex": 0,
            "expectedIntent": "create_appointment",
            "intentMatched": false,
            "hardSlotMismatches": [],
            "proposalTypeMatched": true,
            "expectedEscalates": false,
            "actualEscalated": false,
            "escalationMatched": true
          },
          {
            "turnIndex": 1,
            "expectedIntent": "create_appointment",
            "intentMatched": false,
            "hardSlotMismatches": [],
            "proposalTypeMatched": true,
            "expectedEscalates": false,
            "actualEscalated": false,
            "escalationMatched": true
          }
        ]
      },
      "durationMs": 2,
      "costCents": 0,
      "perTurnLatencyMs": []
    },
    {
      "scriptId": "add-note-escalated",
      "bucket": "07-out-of-scope",
      "passed": false,
      "floorResult": {
        "passed": true,
        "failedCriteria": [],
        "reasons": {}
      },
      "dispositionStructuredResult": {
        "passed": false,
        "failedCriteria": [
          11
        ],
        "reasons": {
          "11": "turn 0: expected escalates=true, got false"
        },
        "perTurnDetail": [
          {
            "turnIndex": 0,
            "intentMatched": true,
            "hardSlotMismatches": [],
            "proposalTypeMatched": true,
            "expectedEscalates": true,
            "actualEscalated": false,
            "escalationMatched": false
          }
        ]
      },
      "durationMs": 0,
      "costCents": 0,
      "perTurnLatencyMs": []
    },
    {
      "scriptId": "after-hours-callback",
      "bucket": "05-compliance-edges",
      "passed": false,
      "floorResult": {
        "passed": true,
        "failedCriteria": [],
        "reasons": {}
      },
      "dispositionStructuredResult": {
        "passed": false,
        "failedCriteria": [
          9,
          10,
          11
        ],
        "reasons": {
          "9": "turn 0: expected intent 'create_appointment', got '<none>'",
          "10": "turn 0: proposalType 'callback' vs '<none>'",
          "11": "turn 0: expected escalates=true, got false"
        },
        "perTurnDetail": [
          {
            "turnIndex": 0,
            "expectedIntent": "create_appointment",
            "intentMatched": false,
            "hardSlotMismatches": [],
            "expectedProposalType": "callback",
            "proposalTypeMatched": false,
            "expectedEscalates": true,
            "actualEscalated": false,
            "escalationMatched": false
          }
        ]
      },
      "durationMs": 1,
      "costCents": 0,
      "perTurnLatencyMs": []
    },
    {
      "scriptId": "caller-id-blocked",
      "bucket": "04-identity-edges",
      "passed": false,
      "floorResult": {
        "passed": true,
        "failedCriteria": [],
        "reasons": {}
      },
      "dispositionStructuredResult": {
        "passed": false,
        "failedCriteria": [
          9,
          11
        ],
        "reasons": {
          "9": "turn 0: expected intent 'lookup_account_summary', got '<none>'",
          "11": "turn 0: expected escalates=true, got false"
        },
        "perTurnDetail": [
          {
            "turnIndex": 0,
            "expectedIntent": "lookup_account_summary",
            "intentMatched": false,
            "hardSlotMismatches": [],
            "proposalTypeMatched": true,
            "expectedEscalates": true,
            "actualEscalated": false,
            "escalationMatched": false
          }
        ]
      },
      "durationMs": 0,
      "costCents": 0,
      "perTurnLatencyMs": []
    },
    {
      "scriptId": "caller-id-matches-existing-lead-not-customer",
      "bucket": "04-identity-edges",
      "passed": false,
      "floorResult": {
        "passed": true,
        "failedCriteria": [],
        "reasons": {}
      },
      "dispositionStructuredResult": {
        "passed": false,
        "failedCriteria": [
          9
        ],
        "reasons": {
          "9": "turn 0: expected intent 'lookup_account_summary', got '<none>'"
        },
        "perTurnDetail": [
          {
            "turnIndex": 0,
            "expectedIntent": "lookup_account_summary",
            "intentMatched": false,
            "hardSlotMismatches": [],
            "proposalTypeMatched": true,
            "expectedEscalates": false,
            "actualEscalated": false,
            "escalationMatched": true
          }
        ]
      },
      "durationMs": 1,
      "costCents": 0,
      "perTurnLatencyMs": []
    },
    {
      "scriptId": "caller-id-matches-multiple-customers",
      "bucket": "04-identity-edges",
      "passed": false,
      "floorResult": {
        "passed": true,
        "failedCriteria": [],
        "reasons": {}
      },
      "dispositionStructuredResult": {
        "passed": false,
        "failedCriteria": [
          9,
          11
        ],
        "reasons": {
          "9": "turn 0: expected intent 'lookup_account_summary', got '<none>'",
          "11": "turn 0: expected escalates=true, got false"
        },
        "perTurnDetail": [
          {
            "turnIndex": 0,
            "expectedIntent": "lookup_account_summary",
            "intentMatched": false,
            "hardSlotMismatches": [],
            "proposalTypeMatched": true,
            "expectedEscalates": true,
            "actualEscalated": false,
            "escalationMatched": false
          }
        ]
      },
      "durationMs": 0,
      "costCents": 0,
      "perTurnLatencyMs": []
    },
    {
      "scriptId": "caller-id-matches-one-customer",
      "bucket": "04-identity-edges",
      "passed": false,